[
    {
        "locode": "BR SOB",
        "cityName": "Sobral",
        "region": "CE",
        "regionName": "Cear\u00e1",
        "actionId": "icare_0075",
        "actionName": "Set carbon emissions reduction targets for industrial sectors",
        "actionPriority": 1,
        "explanation": "Ranked #1 by tournament ranking algorithm"
    },
    {
        "locode": "BR SOB",
        "cityName": "Sobral",
        "region": "CE",
        "regionName": "Cear\u00e1",
        "actionId": "icare_0001",
        "actionName": "Stimulate solar energy production in industrial facilities",
        "actionPriority": 2,
        "explanation": "Ranked #2 by tournament ranking algorithm"
    },
    {
        "locode": "BR SOB",
        "cityName": "Sobral",
        "region": "CE",
        "regionName": "Cear\u00e1",
        "actionId": "icare_0042",
        "actionName": "Encourage renewable energy policies at the municipal level",
        "actionPriority": 3,
        "explanation": "Ranked #3 by tournament ranking algorithm"
    },
    {
        "locode": "BR SOB",
        "cityName": "Sobral",
        "region": "CE",
        "regionName": "Cear\u00e1",
        "actionId": "icare_0074",
        "actionName": "Support research into carbon-neutral manufacturing technologies",
        "actionPriority": 4,
        "explanation": "Ranked #4 by tournament ranking algorithm"
    },
    {
        "locode": "BR SOB",
        "cityName": "Sobral",
        "region": "CE",
        "regionName": "Cear\u00e1",
        "actionId": "icare_0078",
        "actionName": "Develop and implement industrial waste management programs",
        "actionPriority": 5,
        "explanation": "Ranked #5 by tournament ranking algorithm"
    },
    {
        "locode": "BR SOB",
        "cityName": "Sobral",
        "region": "CE",
        "regionName": "Cear\u00e1",
        "actionId": "icare_0081",
        "actionName": "Enhance material recycling in manufacturing",
        "actionPriority": 6,
        "explanation": "Ranked #6 by tournament ranking algorithm"
    },
    {
        "locode": "BR SOB",
        "cityName": "Sobral",
        "region": "CE",
        "regionName": "Cear\u00e1",
        "actionId": "icare_0073",
        "actionName": "Support the transition to low-emission industrial refrigeration",
        "actionPriority": 7,
        "explanation": "Ranked #7 by tournament ranking algorithm"
    },
    {
        "locode": "BR SOB",
        "cityName": "Sobral",
        "region": "CE",
        "regionName": "Cear\u00e1",
        "actionId": "icare_0076",
        "actionName": "Encourage the use of low-emission fuels in industrial processes",
        "actionPriority": 8,
        "explanation": "Ranked #8 by tournament ranking algorithm"
    },
    {
        "locode": "BR SOB",
        "cityName": "Sobral",
        "region": "CE",
        "regionName": "Cear\u00e1",
        "actionId": "icare_0082",
        "actionName": "Transition to renewable energy for industrial operations",
        "actionPriority": 9,
        "explanation": "Ranked #9 by tournament ranking algorithm"
    },
    {
        "locode": "BR SOB",
        "cityName": "Sobral",
        "region": "CE",
        "regionName": "Cear\u00e1",
        "actionId": "icare_0024",
        "actionName": "Integrate renewables into municipal water systems",
        "actionPriority": 10,
        "explanation": "Ranked #10 by tournament ranking algorithm"
    },
    {
        "locode": "BR SOB",
        "cityName": "Sobral",
        "region": "CE",
        "regionName": "Cear\u00e1",
        "actionId": "icare_0038",
        "actionName": "Promote community solar farms",
        "actionPriority": 11,
        "explanation": "Ranked #11 by tournament ranking algorithm"
    },
    {
        "locode": "BR SOB",
        "cityName": "Sobral",
        "region": "CE",
        "regionName": "Cear\u00e1",
        "actionId": "icare_0077",
        "actionName": "Encourage the use of alternative materials in manufacturing",
        "actionPriority": 12,
        "explanation": "Ranked #12 by tournament ranking algorithm"
    },
    {
        "locode": "BR SOB",
        "cityName": "Sobral",
        "region": "CE",
        "regionName": "Cear\u00e1",
        "actionId": "icare_0097",
        "actionName": "Support Distributed Energy Generation in Residences and Businesses",
        "actionPriority": 13,
        "explanation": "Ranked #13 by tournament ranking algorithm"
    },
    {
        "locode": "BR SOB",
        "cityName": "Sobral",
        "region": "CE",
        "regionName": "Cear\u00e1",
        "actionId": "icare_0071",
        "actionName": "Promote the substitution of traditional materials with sustainable alternatives",
        "actionPriority": 14,
        "explanation": "Ranked #14 by tournament ranking algorithm"
    },
    {
        "locode": "BR SOB",
        "cityName": "Sobral",
        "region": "CE",
        "regionName": "Cear\u00e1",
        "actionId": "icare_0079",
        "actionName": "Implement energy audits in industrial plants",
        "actionPriority": 15,
        "explanation": "Ranked #15 by tournament ranking algorithm"
    },
    {
        "locode": "BR SOB",
        "cityName": "Sobral",
        "region": "CE",
        "regionName": "Cear\u00e1",
        "actionId": "icare_0033",
        "actionName": "Install biodigesters in rural properties",
        "actionPriority": 16,
        "explanation": "Ranked #16 by tournament ranking algorithm"
    },
    {
        "locode": "BR SOB",
        "cityName": "Sobral",
        "region": "CE",
        "regionName": "Cear\u00e1",
        "actionId": "icare_0040",
        "actionName": "Adopt solar-powered street lighting in rural areas",
        "actionPriority": 17,
        "explanation": "Ranked #17 by tournament ranking algorithm"
    },
    {
        "locode": "BR SOB",
        "cityName": "Sobral",
        "region": "CE",
        "regionName": "Cear\u00e1",
        "actionId": "icare_0131",
        "actionName": "Prioritize Procurement of Locally Produced Agroecological Products in Public Purchases",
        "actionPriority": 18,
        "explanation": "Ranked #18 by tournament ranking algorithm"
    },
    {
        "locode": "BR SOB",
        "cityName": "Sobral",
        "region": "CE",
        "regionName": "Cear\u00e1",
        "actionId": "icare_0011",
        "actionName": "Provide tax incentives for renewable energy in residential projects",
        "actionPriority": 19,
        "explanation": "Ranked #19 by tournament ranking algorithm"
    },
    {
        "locode": "BR SOB",
        "cityName": "Sobral",
        "region": "CE",
        "regionName": "Cear\u00e1",
        "actionId": "icare_0072",
        "actionName": "Promote industry-government collaborations on emissions reduction",
        "actionPriority": 20,
        "explanation": "Ranked #20 by tournament ranking algorithm"
    }
]