[
    {
        "locode": "BR BVB",
        "cityName": "Boa Vista",
        "region": "RR",
        "regionName": "Roraima",
        "actionId": "icare_0050",
        "actionName": "Implement Agroforestry Systems",
        "actionPriority": 1,
        "explanation": "Ranked #1 by tournament ranking algorithm"
    },
    {
        "locode": "BR BVB",
        "cityName": "Boa Vista",
        "region": "RR",
        "regionName": "Roraima",
        "actionId": "icare_0133",
        "actionName": "Promote Urban Reforestation and Green Corridors",
        "actionPriority": 2,
        "explanation": "Ranked #2 by tournament ranking algorithm"
    },
    {
        "locode": "BR BVB",
        "cityName": "Boa Vista",
        "region": "RR",
        "regionName": "Roraima",
        "actionId": "icare_0134",
        "actionName": "Strengthen Mechanisms for Deforestation Control",
        "actionPriority": 3,
        "explanation": "Ranked #3 by tournament ranking algorithm"
    },
    {
        "locode": "BR BVB",
        "cityName": "Boa Vista",
        "region": "RR",
        "regionName": "Roraima",
        "actionId": "icare_0129",
        "actionName": "Facilitate Technology Transfer for Conservation Practices",
        "actionPriority": 4,
        "explanation": "Ranked #4 by tournament ranking algorithm"
    },
    {
        "locode": "BR BVB",
        "cityName": "Boa Vista",
        "region": "RR",
        "regionName": "Roraima",
        "actionId": "icare_0130",
        "actionName": "Conduct Technical Assistance and Rural Extension (ATER) Actions",
        "actionPriority": 5,
        "explanation": "Ranked #5 by tournament ranking algorithm"
    },
    {
        "locode": "BR BVB",
        "cityName": "Boa Vista",
        "region": "RR",
        "regionName": "Roraima",
        "actionId": "icare_0128",
        "actionName": "Establish Municipal Programs for Payment for Environmental Services (PES)",
        "actionPriority": 6,
        "explanation": "Ranked #6 by tournament ranking algorithm"
    },
    {
        "locode": "BR BVB",
        "cityName": "Boa Vista",
        "region": "RR",
        "regionName": "Roraima",
        "actionId": "icare_0139",
        "actionName": "Implementation of urban toll.",
        "actionPriority": 7,
        "explanation": "Ranked #7 by tournament ranking algorithm"
    },
    {
        "locode": "BR BVB",
        "cityName": "Boa Vista",
        "region": "RR",
        "regionName": "Roraima",
        "actionId": "icare_0131",
        "actionName": "Prioritize Procurement of Locally Produced Agroecological Products in Public Purchases",
        "actionPriority": 8,
        "explanation": "Ranked #8 by tournament ranking algorithm"
    },
    {
        "locode": "BR BVB",
        "cityName": "Boa Vista",
        "region": "RR",
        "regionName": "Roraima",
        "actionId": "icare_0088",
        "actionName": "Implementation of free public transportation programs during peak hours to reduce the use of individual vehicles",
        "actionPriority": 9,
        "explanation": "Ranked #9 by tournament ranking algorithm"
    },
    {
        "locode": "BR BVB",
        "cityName": "Boa Vista",
        "region": "RR",
        "regionName": "Roraima",
        "actionId": "icare_0068",
        "actionName": "Deploy on-demand transport systems with 100% electric fleets.",
        "actionPriority": 10,
        "explanation": "Ranked #10 by tournament ranking algorithm"
    },
    {
        "locode": "BR BVB",
        "cityName": "Boa Vista",
        "region": "RR",
        "regionName": "Roraima",
        "actionId": "icare_0044",
        "actionName": "Expand the cycling infrastructure and build public walkways and accessible sidewalks, prioritizing measures resilient to climate threats",
        "actionPriority": 11,
        "explanation": "Ranked #11 by tournament ranking algorithm"
    },
    {
        "locode": "BR BVB",
        "cityName": "Boa Vista",
        "region": "RR",
        "regionName": "Roraima",
        "actionId": "icare_0094",
        "actionName": "Adoption of biomethane in public fleets.",
        "actionPriority": 12,
        "explanation": "Ranked #12 by tournament ranking algorithm"
    },
    {
        "locode": "BR BVB",
        "cityName": "Boa Vista",
        "region": "RR",
        "regionName": "Roraima",
        "actionId": "icare_0132",
        "actionName": "Encourage Local Agroecological Production and Short Supply Chains",
        "actionPriority": 13,
        "explanation": "Ranked #13 by tournament ranking algorithm"
    },
    {
        "locode": "BR BVB",
        "cityName": "Boa Vista",
        "region": "RR",
        "regionName": "Roraima",
        "actionId": "icare_0057",
        "actionName": "Expansion of mass transit systems on rails (metros, LRTs, and monorails).",
        "actionPriority": 14,
        "explanation": "Ranked #14 by tournament ranking algorithm"
    },
    {
        "locode": "BR BVB",
        "cityName": "Boa Vista",
        "region": "RR",
        "regionName": "Roraima",
        "actionId": "icare_0136",
        "actionName": "Support the Implementation of Ecological Fiscal Incentives",
        "actionPriority": 15,
        "explanation": "Ranked #15 by tournament ranking algorithm"
    },
    {
        "locode": "BR BVB",
        "cityName": "Boa Vista",
        "region": "RR",
        "regionName": "Roraima",
        "actionId": "icare_0085",
        "actionName": "Promote the Adoption of Agroecological Pest Control",
        "actionPriority": 16,
        "explanation": "Ranked #16 by tournament ranking algorithm"
    },
    {
        "locode": "BR BVB",
        "cityName": "Boa Vista",
        "region": "RR",
        "regionName": "Roraima",
        "actionId": "icare_0099",
        "actionName": "Support Agroecological Certification Programs",
        "actionPriority": 17,
        "explanation": "Ranked #17 by tournament ranking algorithm"
    },
    {
        "locode": "BR BVB",
        "cityName": "Boa Vista",
        "region": "RR",
        "regionName": "Roraima",
        "actionId": "c40_0026",
        "actionName": "Vehicle Emissions",
        "actionPriority": 18,
        "explanation": "Ranked #18 by tournament ranking algorithm"
    },
    {
        "locode": "BR BVB",
        "cityName": "Boa Vista",
        "region": "RR",
        "regionName": "Roraima",
        "actionId": "icare_0102",
        "actionName": "Promote Sustainable Agricultural Practices",
        "actionPriority": 19,
        "explanation": "Ranked #19 by tournament ranking algorithm"
    },
    {
        "locode": "BR BVB",
        "cityName": "Boa Vista",
        "region": "RR",
        "regionName": "Roraima",
        "actionId": "icare_0100",
        "actionName": "Support Regenerative Agriculture Practices",
        "actionPriority": 20,
        "explanation": "Ranked #20 by tournament ranking algorithm"
    }
]