[
    {
        "locode": "BR IIP",
        "cityName": "Itapipoca",
        "region": "CE",
        "regionName": "Cear\u00e1",
        "actionId": "icare_0050",
        "actionName": "Implement Agroforestry Systems",
        "actionPriority": 1,
        "explanation": "Ranked #1 by tournament ranking algorithm"
    },
    {
        "locode": "BR IIP",
        "cityName": "Itapipoca",
        "region": "CE",
        "regionName": "Cear\u00e1",
        "actionId": "icare_0134",
        "actionName": "Strengthen Mechanisms for Deforestation Control",
        "actionPriority": 2,
        "explanation": "Ranked #2 by tournament ranking algorithm"
    },
    {
        "locode": "BR IIP",
        "cityName": "Itapipoca",
        "region": "CE",
        "regionName": "Cear\u00e1",
        "actionId": "icare_0133",
        "actionName": "Promote Urban Reforestation and Green Corridors",
        "actionPriority": 3,
        "explanation": "Ranked #3 by tournament ranking algorithm"
    },
    {
        "locode": "BR IIP",
        "cityName": "Itapipoca",
        "region": "CE",
        "regionName": "Cear\u00e1",
        "actionId": "icare_0130",
        "actionName": "Conduct Technical Assistance and Rural Extension (ATER) Actions",
        "actionPriority": 4,
        "explanation": "Ranked #4 by tournament ranking algorithm"
    },
    {
        "locode": "BR IIP",
        "cityName": "Itapipoca",
        "region": "CE",
        "regionName": "Cear\u00e1",
        "actionId": "icare_0128",
        "actionName": "Establish Municipal Programs for Payment for Environmental Services (PES)",
        "actionPriority": 5,
        "explanation": "Ranked #5 by tournament ranking algorithm"
    },
    {
        "locode": "BR IIP",
        "cityName": "Itapipoca",
        "region": "CE",
        "regionName": "Cear\u00e1",
        "actionId": "icare_0129",
        "actionName": "Facilitate Technology Transfer for Conservation Practices",
        "actionPriority": 6,
        "explanation": "Ranked #6 by tournament ranking algorithm"
    },
    {
        "locode": "BR IIP",
        "cityName": "Itapipoca",
        "region": "CE",
        "regionName": "Cear\u00e1",
        "actionId": "icare_0096",
        "actionName": "Promote Organic Farming",
        "actionPriority": 7,
        "explanation": "Ranked #7 by tournament ranking algorithm"
    },
    {
        "locode": "BR IIP",
        "cityName": "Itapipoca",
        "region": "CE",
        "regionName": "Cear\u00e1",
        "actionId": "icare_0131",
        "actionName": "Prioritize Procurement of Locally Produced Agroecological Products in Public Purchases",
        "actionPriority": 8,
        "explanation": "Ranked #8 by tournament ranking algorithm"
    },
    {
        "locode": "BR IIP",
        "cityName": "Itapipoca",
        "region": "CE",
        "regionName": "Cear\u00e1",
        "actionId": "icare_0084",
        "actionName": "Create Incentives for Agroforestry Practices in Livestock Systems",
        "actionPriority": 9,
        "explanation": "Ranked #9 by tournament ranking algorithm"
    },
    {
        "locode": "BR IIP",
        "cityName": "Itapipoca",
        "region": "CE",
        "regionName": "Cear\u00e1",
        "actionId": "icare_0094",
        "actionName": "Adoption of biomethane in public fleets.",
        "actionPriority": 10,
        "explanation": "Ranked #10 by tournament ranking algorithm"
    },
    {
        "locode": "BR IIP",
        "cityName": "Itapipoca",
        "region": "CE",
        "regionName": "Cear\u00e1",
        "actionId": "icare_0102",
        "actionName": "Promote Sustainable Agricultural Practices",
        "actionPriority": 11,
        "explanation": "Ranked #11 by tournament ranking algorithm"
    },
    {
        "locode": "BR IIP",
        "cityName": "Itapipoca",
        "region": "CE",
        "regionName": "Cear\u00e1",
        "actionId": "icare_0100",
        "actionName": "Support Regenerative Agriculture Practices",
        "actionPriority": 12,
        "explanation": "Ranked #12 by tournament ranking algorithm"
    },
    {
        "locode": "BR IIP",
        "cityName": "Itapipoca",
        "region": "CE",
        "regionName": "Cear\u00e1",
        "actionId": "icare_0121",
        "actionName": "Incentive to create bike-sharing programs in urban areas, with a focus on electric bikes.",
        "actionPriority": 13,
        "explanation": "Ranked #13 by tournament ranking algorithm"
    },
    {
        "locode": "BR IIP",
        "cityName": "Itapipoca",
        "region": "CE",
        "regionName": "Cear\u00e1",
        "actionId": "icare_0052",
        "actionName": "Develop projects for renewable energy and waste reuse",
        "actionPriority": 14,
        "explanation": "Ranked #14 by tournament ranking algorithm"
    },
    {
        "locode": "BR IIP",
        "cityName": "Itapipoca",
        "region": "CE",
        "regionName": "Cear\u00e1",
        "actionId": "icare_0088",
        "actionName": "Implementation of free public transportation programs during peak hours to reduce the use of individual vehicles",
        "actionPriority": 15,
        "explanation": "Ranked #15 by tournament ranking algorithm"
    },
    {
        "locode": "BR IIP",
        "cityName": "Itapipoca",
        "region": "CE",
        "regionName": "Cear\u00e1",
        "actionId": "icare_0099",
        "actionName": "Support Agroecological Certification Programs",
        "actionPriority": 16,
        "explanation": "Ranked #16 by tournament ranking algorithm"
    },
    {
        "locode": "BR IIP",
        "cityName": "Itapipoca",
        "region": "CE",
        "regionName": "Cear\u00e1",
        "actionId": "icare_0136",
        "actionName": "Support the Implementation of Ecological Fiscal Incentives",
        "actionPriority": 17,
        "explanation": "Ranked #17 by tournament ranking algorithm"
    },
    {
        "locode": "BR IIP",
        "cityName": "Itapipoca",
        "region": "CE",
        "regionName": "Cear\u00e1",
        "actionId": "icare_0085",
        "actionName": "Promote the Adoption of Agroecological Pest Control",
        "actionPriority": 18,
        "explanation": "Ranked #18 by tournament ranking algorithm"
    },
    {
        "locode": "BR IIP",
        "cityName": "Itapipoca",
        "region": "CE",
        "regionName": "Cear\u00e1",
        "actionId": "icare_0132",
        "actionName": "Encourage Local Agroecological Production and Short Supply Chains",
        "actionPriority": 19,
        "explanation": "Ranked #19 by tournament ranking algorithm"
    },
    {
        "locode": "BR IIP",
        "cityName": "Itapipoca",
        "region": "CE",
        "regionName": "Cear\u00e1",
        "actionId": "c40_0035",
        "actionName": "Waste Efficiency",
        "actionPriority": 20,
        "explanation": "Ranked #20 by tournament ranking algorithm"
    }
]